{
  "schema_version": 1,
  "style_id": "megami_magazine",
  "palette": [
    {
      "name": "paper cream",
      "hex": "#F3EEE5",
      "usage": "large readable panel centers and torn-paper surfaces"
    },
    {
      "name": "hot magazine pink",
      "hex": "#E94D91",
      "usage": "primary buttons, stickers, energetic title accents"
    },
    {
      "name": "cyan cover blue",
      "hex": "#0AA6D2",
      "usage": "brush strokes, progress bars, active highlights"
    },
    {
      "name": "black tape",
      "hex": "#111111",
      "usage": "tape strips, dividers, strong outer accents"
    },
    {
      "name": "soft ink",
      "hex": "#675D65",
      "usage": "muted text and low-priority UI"
    }
  ],
  "motifs": [
    "torn paper edges",
    "polaroid photo frames",
    "black tape strips",
    "cyan brush underlines",
    "pink sticker accents",
    "halftone dot clusters",
    "hand-drawn star and heart marks"
  ],
  "materials": [
    "matte printed paper",
    "slightly glossy magazine ink",
    "rough paper tear fibers",
    "semi-gloss black tape",
    "screen-print halftone texture"
  ],
  "layout_language": [
    "asymmetric collage",
    "slightly tilted cards",
    "layered scraps with visible overlap",
    "large clean text-safe centers",
    "decorative marks near corners, not across content"
  ],
  "component_rules": {
    "panel": "Use torn-paper silhouettes with blue or pink outline accents and a calm cream content center.",
    "button": "Use sticker-like rounded paper strips with hot pink fill, cyan stroke, and a clean central text lane.",
    "bar": "Use magazine cutout meter strips with black ink frame and cyan/pink fill separation.",
    "icon": "Use polaroid or sticker frames with tape corners and empty central image space.",
    "decor": "Use tape, brush strokes, halftone clusters, doodle marks, and paper scraps as separate overlay elements."
  },
  "avoid": [
    "do not copy the Megami logo",
    "do not generate characters, faces, bodies, or portraits inside UI assets",
    "do not bake readable text into generated art",
    "do not cover the central text-safe area with grunge",
    "avoid realistic metal, medieval frames, or generic sci-fi neon panels"
  ]
}
